<?xml version="1.0" encoding="UTF-8"?>
<template xmlns="http://napkinlaf.sf.net/sketch/"
          xmlns:xsi="http://www.w3.org/2001/XMLSchema-instance"
          xsi:schemaLocation="http://napkinlaf.sf.net/sketch Template.xsd">
    <!-- $Id: Directory.xml 293 2006-03-06 14:18:49Z kcrca $ -->
    <title>Directory</title>
    <description>A directory/folder</description>

    <clippingBounds>
        <dimensions>
            <width>19</width>
            <height>18</height>
        </dimensions>
    </clippingBounds>

    <templateItem>                <!-- folder tab -->
        <path>
            <moveTo>
                <point>
                    <x>1</x>
                    <y>4</y>
                </point>
            </moveTo>
            <lineTo>
                <point>
                    <x>3</x>
                    <y>2</y>
                </point>
            </lineTo>
            <lineTo>
                <point>
                    <x>7</x>
                    <y>2</y>
                </point>
            </lineTo>
            <lineTo>
                <point>
                    <x>9</x>
                    <y>4</y>
                </point>
            </lineTo>
        </path>
    </templateItem>

    <templateItem>                <!-- folder front -->
        <path>
            <moveTo>
                <point>
                    <x>14</x>
                    <y>5</y>
                </point>
            </moveTo>
            <lineTo>
                <point>
                    <x>1</x>
                    <y>5</y>
                </point>
            </lineTo>
            <lineTo>
                <point>
                    <x>1</x>
                    <y>15</y>
                </point>
            </lineTo>
            <lineTo>
                <point>
                    <x>15</x>
                    <y>15</y>
                </point>
            </lineTo>
            <lineTo>
                <point>
                    <x>15</x>
                    <y>5</y>
                </point>
            </lineTo>
            <close/>
        </path>
    </templateItem>

</template>
