<?xml version="1.0" encoding="UTF-8"?>
<template xmlns="http://www.mqp.wpi.edu/napkin/" xmlns:xsi="http://www.w3.org/2001/XMLSchema-instance" xsi:schemaLocation="http://www.mqp.wpi.edu/napkin/ Template.xsd">
	<title>Up Folder</title>
	<description>Up</description>
	<clippingBounds>
		<dimensions>
			<width>19</width>
			<height>18</height>
		</dimensions>
	</clippingBounds>
	<!-- folder tab -->
	<templateItem>
		<drawStroke>true</drawStroke>
		<drawFill>true</drawFill>
		<strokeWeight>1</strokeWeight>
		<strokeColor>
			<r>0</r>
			<g>0</g>
			<b>0</b>
		</strokeColor>
		<fillColor>
			<r>255</r>
			<g>255</g>
			<b>128</b>
		</fillColor>
		<path>
			<moveTo>
				<point>
					<x>1</x>
					<y>4</y>
				</point>
			</moveTo>
			<lineTo>
				<point>
					<x>3</x>
					<y>2</y>
				</point>
			</lineTo>
			<lineTo>
				<point>
					<x>7</x>
					<y>2</y>
				</point>
			</lineTo>
			<lineTo>
				<point>
					<x>9</x>
					<y>4</y>
				</point>
			</lineTo>
		</path>
	</templateItem>
	<!-- folder front -->
	<templateItem>
		<drawStroke>true</drawStroke>
		<drawFill>true</drawFill>
		<strokeWeight>1</strokeWeight>
		<strokeColor>
			<r>0</r>
			<g>0</g>
			<b>0</b>
		</strokeColor>
		<fillColor>
			<r>255</r>
			<g>255</g>
			<b>128</b>
		</fillColor>
		<path>
			<moveTo>
				<point>
					<x>14</x>
					<y>4</y>
				</point>
			</moveTo>
			<lineTo>
				<point>
					<x>1</x>
					<y>4</y>
				</point>
			</lineTo>
			<lineTo>
				<point>
					<x>1</x>
					<y>14</y>
				</point>
			</lineTo>
			<lineTo>
				<point>
					<x>15</x>
					<y>14</y>
				</point>
			</lineTo>
			<lineTo>
				<point>
					<x>15</x>
					<y>5</y>
				</point>
			</lineTo>
			<close/>
		</path>
	</templateItem>
	<!-- arrow head -->
	<templateItem>
		<drawStroke>true</drawStroke>
		<drawFill>true</drawFill>
		<strokeWeight>1</strokeWeight>
		<strokeColor>
			<r>0</r>
			<g>0</g>
			<b>0</b>
		</strokeColor>
		<fillColor>
			<r>0</r>
			<g>0</g>
			<b>0</b>
		</fillColor>
		<path>
			<moveTo>
				<point>
					<x>4</x>
					<y>8</y>
				</point>
			</moveTo>
			<lineTo>
				<point>
					<x>6</x>
					<y>6</y>
				</point>
			</lineTo>
			<lineTo>
				<point>
					<x>8</x>
					<y>8</y>
				</point>
			</lineTo>
			<lineTo>
				<point>
					<x>4</x>
					<y>8</y>
				</point>
			</lineTo>
			<close/>
		</path>
	</templateItem>
	<!-- arrow tail -->
	<templateItem>
		<drawStroke>true</drawStroke>
		<drawFill>false</drawFill>
		<strokeWeight>1</strokeWeight>
		<strokeColor>
			<r>0</r>
			<g>0</g>
			<b>0</b>
		</strokeColor>
		<path>
			<moveTo>
				<point>
					<x>6</x>
					<y>9</y>
				</point>
			</moveTo>
			<lineTo>
				<point>
					<x>6</x>
					<y>11</y>
				</point>
			</lineTo>
			<lineTo>
				<point>
					<x>10</x>
					<y>11</y>
				</point>
			</lineTo>
		</path>
	</templateItem>
</template>
