<?xml version="1.0" encoding="UTF-8"?>
<template xmlns="http://www.mqp.wpi.edu/napkin/" xmlns:xsi="http://www.w3.org/2001/XMLSchema-instance" xsi:schemaLocation="http://www.mqp.wpi.edu/napkin/
Template.xsd">
	<title>Warning Icon</title>
	<description>warning icon</description>
	<clippingBounds>
		<dimensions>
			<width>24</width>
			<height>24</height>
		</dimensions>
	</clippingBounds>
	<!-- floppy disk body -->
	<templateItem>
		<drawStroke>true</drawStroke>
		<drawFill>true</drawFill>
		<strokeColor>
			<r>64</r>
			<g>64</g>
			<b>128</b>
		</strokeColor>
		<fillColor>
			<r>64</r>
			<g>64</g>
			<b>192</b>
		</fillColor>
		<path>
			<moveTo>
				<point>
					<x>1</x>
					<y>22</y>
				</point>
			</moveTo>
			<lineTo>
				<point>
					<x>1</x>
					<y>2</y>
				</point>
			</lineTo>
			<lineTo>
				<point>
					<x>21</x>
					<y>2</y>
				</point>
			</lineTo>
			<lineTo>
				<point>
					<x>21</x>
					<y>22</y>
				</point>
			</lineTo>
			<close/>
		</path>
	</templateItem>
	<!-- floppy disk label -->
	<templateItem>
		<drawStroke>true</drawStroke>
		<drawFill>true</drawFill>
		<strokeColor>
			<r>192</r>
			<g>192</g>
			<b>192</b>
		</strokeColor>
		<fillColor>
			<r>255</r>
			<g>255</g>
			<b>255</b>
		</fillColor>
		<path>
			<moveTo>
				<point>
					<x>4</x>
					<y>12</y>
				</point>
			</moveTo>
			<lineTo>
				<point>
					<x>4</x>
					<y>2</y>
				</point>
			</lineTo>
			<lineTo>
				<point>
					<x>18</x>
					<y>2</y>
				</point>
			</lineTo>
			<lineTo>
				<point>
					<x>18</x>
					<y>12</y>
				</point>
			</lineTo>
			<close/>
		</path>
	</templateItem>
	<!-- floppy disk label lines -->
	<templateItem>
		<drawStroke>true</drawStroke>
		<drawFill>false</drawFill>
		<strokeColor>
			<r>192</r>
			<g>192</g>
			<b>192</b>
		</strokeColor>
		<path>
			<moveTo>
				<point>
					<x>6</x>
					<y>4</y>
				</point>
			</moveTo>
			<lineTo>
				<point>
					<x>16</x>
					<y>4</y>
				</point>
			</lineTo>
			<moveTo>
				<point>
					<x>6</x>
					<y>6</y>
				</point>
			</moveTo>
			<lineTo>
				<point>
					<x>16</x>
					<y>6</y>
				</point>
			</lineTo>
			<moveTo>
				<point>
					<x>6</x>
					<y>8</y>
				</point>
			</moveTo>
			<lineTo>
				<point>
					<x>16</x>
					<y>8</y>
				</point>
			</lineTo>
		</path>
	</templateItem>
	<!-- floppy disk metal slider depression -->
	<templateItem>
		<drawStroke>false</drawStroke>
		<drawFill>true</drawFill>
		<fillColor>
			<r>64</r>
			<g>64</g>
			<b>128</b>
		</fillColor>
		<path>
			<moveTo>
				<point>
					<x>6</x>
					<y>15</y>
				</point>
			</moveTo>
			<lineTo>
				<point>
					<x>18</x>
					<y>15</y>
				</point>
			</lineTo>
			<lineTo>
				<point>
					<x>18</x>
					<y>22</y>
				</point>
			</lineTo>
			<lineTo>
				<point>
					<x>6</x>
					<y>22</y>
				</point>
			</lineTo>
			<close/>
		</path>
	</templateItem>
	<!-- floppy disk metal slider -->
	<templateItem>
		<drawStroke>false</drawStroke>
		<drawFill>true</drawFill>
		<strokeColor>
			<r>64</r>
			<g>64</g>
			<b>128</b>
		</strokeColor>
		<fillColor>
			<r>192</r>
			<g>192</g>
			<b>192</b>
		</fillColor>
		<path>
			<moveTo>
				<point>
					<x>7</x>
					<y>22</y>
				</point>
			</moveTo>
			<lineTo>
				<point>
					<x>7</x>
					<y>15</y>
				</point>
			</lineTo>
			<lineTo>
				<point>
					<x>15</x>
					<y>15</y>
				</point>
			</lineTo>
			<lineTo>
				<point>
					<x>15</x>
					<y>22</y>
				</point>
			</lineTo>
			<lineTo>
				<point>
					<x>7</x>
					<y>22</y>
				</point>
			</lineTo>
			<moveTo>
				<point>
					<x>8</x>
					<y>20</y>
				</point>
			</moveTo>
			<lineTo>
				<point>
					<x>10</x>
					<y>20</y>
				</point>
			</lineTo>
			<lineTo>
				<point>
					<x>10</x>
					<y>16</y>
				</point>
			</lineTo>
			<lineTo>
				<point>
					<x>8</x>
					<y>16</y>
				</point>
			</lineTo>
			<close/>
		</path>
	</templateItem>
</template>
