<?xml version="1.0" encoding="UTF-8"?>
<template xmlns="http://www.mqp.wpi.edu/napkin/"
        xmlns:xsi="http://www.w3.org/2001/XMLSchema-instance"
        xsi:schemaLocation="http://www.mqp.wpi.edu/napkin/Template.xsd">
    <!-- $Id$ -->
    <title>filenew.svg</title>
    <description>filenew.svg</description>

    <clippingBounds>
        <dimensions>
            <width>19</width>
            <height>18</height>
        </dimensions>
    </clippingBounds>

    <templateItem>
        <drawStroke>true</drawStroke>
        <drawFill>false</drawFill>
        <strokeWeight>1</strokeWeight>
        <strokeColor>
            <r>0</r>
            <g>0</g>
            <b>0</b>
        </strokeColor>
        <fillColor>
            <r>0</r>
            <g>0</g>
            <b>0</b>
        </fillColor>
        <path>
            <moveTo>
                <point>
                    <x>3</x>
                    <y>3</y>
                </point>
            </moveTo>
            <lineTo>
                <point>
                    <x>3</x>
                    <y>3</y>
                </point>
            </lineTo>
            <moveTo>
                <point>
                    <x>5</x>
                    <y>3</y>
                </point>
            </moveTo>
            <lineTo>
                <point>
                    <x>11</x>
                    <y>3</y>
                </point>
            </lineTo>
            <moveTo>
                <point>
                    <x>13</x>
                    <y>3</y>
                </point>
            </moveTo>
            <lineTo>
                <point>
                    <x>16</x>
                    <y>3</y>
                </point>
            </lineTo>
        </path>
    </templateItem>

    <templateItem>
        <drawStroke>true</drawStroke>
        <drawFill>false</drawFill>
        <strokeWeight>1</strokeWeight>
        <strokeColor>
            <r>0</r>
            <g>0</g>
            <b>0</b>
        </strokeColor>
        <fillColor>
            <r>0</r>
            <g>0</g>
            <b>0</b>
        </fillColor>
        <path>
            <moveTo>
                <point>
                    <x>3</x>
                    <y>8</y>
                </point>
            </moveTo>
            <lineTo>
                <point>
                    <x>3</x>
                    <y>8</y>
                </point>
            </lineTo>
            <moveTo>
                <point>
                    <x>5</x>
                    <y>8</y>
                </point>
            </moveTo>
            <lineTo>
                <point>
                    <x>11</x>
                    <y>8</y>
                </point>
            </lineTo>
            <moveTo>
                <point>
                    <x>13</x>
                    <y>8</y>
                </point>
            </moveTo>
            <lineTo>
                <point>
                    <x>16</x>
                    <y>8</y>
                </point>
            </lineTo>
        </path>
    </templateItem>

    <templateItem>
        <drawStroke>true</drawStroke>
        <drawFill>false</drawFill>
        <strokeWeight>1</strokeWeight>
        <strokeColor>
            <r>0</r>
            <g>0</g>
            <b>0</b>
        </strokeColor>
        <fillColor>
            <r>0</r>
            <g>0</g>
            <b>0</b>
        </fillColor>
        <path>
            <moveTo>
                <point>
                    <x>3</x>
                    <y>13</y>
                </point>
            </moveTo>
            <lineTo>
                <point>
                    <x>3</x>
                    <y>13</y>
                </point>
            </lineTo>
            <moveTo>
                <point>
                    <x>5</x>
                    <y>13</y>
                </point>
            </moveTo>
            <lineTo>
                <point>
                    <x>11</x>
                    <y>13</y>
                </point>
            </lineTo>
            <moveTo>
                <point>
                    <x>13</x>
                    <y>13</y>
                </point>
            </moveTo>
            <lineTo>
                <point>
                    <x>16</x>
                    <y>13</y>
                </point>
            </lineTo>
        </path>
    </templateItem>

</template>
